{
  "schema_version": "octon-mini.project.context-pack-manifest.v1",
  "id": "CTXPACK-9001",
  "manifest_version": "1.0.0",
  "status": "active",
  "permission_grant": false,
  "purpose": "Support a bounded architecture review without loading unrelated project history.",
  "consumer": {
    "id": "agent-role:architecture-reviewer",
    "kind": "agent_role"
  },
  "task_class": "architecture_review",
  "scope": {
    "included_resources": [
      "project-dossier/canonical/architecture-or-outcome-model.md",
      "project-dossier/provenance/README.md"
    ],
    "excluded_resources": [
      "project-dossier/history/"
    ],
    "maximum_items": 2
  },
  "content_ref": "project-dossier/context-packs/architecture-review.md",
  "sources": [
    {
      "source_ref": "SRC-9001",
      "exact_version_or_digest": "sha256:1111111111111111111111111111111111111111111111111111111111111111",
      "authority_status": "authoritative",
      "selected_sections": [
        "boundaries",
        "invariants"
      ],
      "observed_at": "2030-01-01T10:00:00Z",
      "fresh_until": "2030-02-01T10:00:00Z",
      "selection_basis": "Only the architecture sections required by the declared task class are included.",
      "limitations": [
        "The source governs intended architecture only, not current implementation."
      ]
    }
  ],
  "freshness": {
    "created_at": "2030-01-02T10:00:00Z",
    "valid_until": "2030-01-20T10:00:00Z",
    "revalidate_after": "2030-01-10T10:00:00Z",
    "revalidation_method": "Re-resolve every source reference and compare its exact digest and authority status."
  },
  "sensitivity": "internal",
  "allowed_use": {
    "purposes": [
      "architecture_review"
    ],
    "prohibited_uses": [
      "external_publication",
      "model_training"
    ],
    "rights_basis": "Project-owned internal review material for the named consumer.",
    "egress": "same_project"
  },
  "retention": {
    "retain_until": "2030-01-22T10:00:00Z",
    "deletion_method": "Delete the derived pack after preserving only its manifest and required review evidence.",
    "deletion_evidence_required": true
  },
  "invalidation_triggers": [
    "source_version_change",
    "source_authority_change",
    "consumer_change",
    "scope_change"
  ],
  "revocation": {
    "status": "active",
    "revoked_at": null,
    "reason": null,
    "successor": null
  },
  "stale_or_revoked_use": "prohibited_until_revalidated_or_reissued",
  "exclusions": [
    "Historical narrative and unrelated current-state material are intentionally omitted."
  ],
  "size_budget": {
    "unit": "items",
    "maximum": 2,
    "measured": 2
  },
  "owner": "dossier_maintainer",
  "unresolved_inputs": [],
  "limitations": [
    "Repository validation cannot prove provider-side retention or deletion behavior."
  ],
  "non_proven_implications": [
    "Receipt of this pack does not grant action authority, establish capability, or prove project readiness."
  ]
}
